<?xml version="1.0"?>
<!DOCTYPE presentation SYSTEM "jabberpoint.dtd">
<presentation>
    <version>1.0.0</version>
    <presentationTitle>Testing Presentation</presentationTitle>
    <slide>
        <title>Default Styling</title>
        <textItem>A text item with no styles, so default style</textItem>
        <textItem style="1">Font size test1</textItem>
        <textItem style="2">Font size test2</textItem>
        <textItem style="3">Font size test3</textItem>
        <textItem style="4">Font size test4</textItem>
        <textItem style="5">Font size test5</textItem>
    </slide>
    <slide>
        <title>Custom styling</title>
        <textItem font="Helvetica" color="#00FF00" size="16" indent="16">A text item with custom styling</textItem>
        <textItem style="2" color="#FF0000" indent="16">A text item with a preset style and overwrites</textItem>
    </slide>
    <slide>
        <title>Images</title>
        <imageItem x="80" y="350">serclogo_fc.jpg</imageItem>
        <imageItem x="800" y="600">logo-woordmerk_ou.gif</imageItem>
        <imageItem x="100" y="100">JabberPoint.gif</imageItem>
    </slide>
</presentation>
